,title,company,description,location,posted_date
437, Sr. Data Engineer ," ScrumLink, Inc. ","Job Title : Sr. Data Engineer  Location : Berkeley Heights ,NJ Duration : 12+ Months   Job Description:- Design and implement Cloud-native architectures that will allow business requirements to be met with a minimal degree of risk to the organization. Perform threat modelling and design reviews to assess security implications and requirements for introduction of new technologies. Involve in all aspects of architecture, design, build, engineering, and implementation of technical solutions using i"," Remote or Berkeley Heights, NJ, USA ", Posted 10 days ago
438," Distinguished Data Engineer, Enterprise Data Platforms - Data Creation (Remote Eligible) ", Capital One ,"Center 1 (19052), United States of America, McLean, Virginia  Distinguished Data Engineer, Enterprise Data Platforms - Data Creation (Remote Eligible)  Come join my teams in Enterprise Data & Machine Learning group to build a highly scalable, well governed, data ecosystem that scales across 1000's of AWS accounts, tens of thousands of database instances and millions of files stored across enterprise. You will also have the opportunity to shape the future of the platform that exchanges terabytes "," McLean, VA, USA ", Posted 36 days ago
439, Data Engineer 2 , Apex Systems ,"Job#: 1326216 Job Description: Data Engineer 2:  Summary: The main function of a data engineer is to ensure that the data assets of an organization are supported by an architecture that supports the organization in achieving its strategic goal.A typical data engineer is responsible for setting enterprise standards for databases, data integration, and the means to get to the data. Responsibilities Include: Test programs or databases, correct errors and make necessary modifications.Modify existing"," Morton, IL, USA ", Posted 60+ days ago
440, Data Engineer , Infinity Consulting Solutions ,"TITLE: Data Engineer Location: Houston, Texas Compensation Range : $40/hr -$80hr Our client is looking to hire multiple Data Engineers to join their growing team! You will be part of a team that is working on inhouse, Real Time Data Applications. This is a multi-year contract. Oil and Gas experience is a plus!  Mid Level Having strong Python fundamentals, REST protocol, Flask/FastAPI platform Having knowledge of microservice architecture, system design, SQL and NoSQL databases Having knowledge o"," Houston, TX, USA ", Posted 21 days ago
441, Lead Azure Data Engineer ," KPI Partners, Inc. ","KPI Partners, A global consulting firm focused on strategy, technology, and digital transformation. We help companies tackle their most ambitious projects and build new capabilities. We provide solutions in Cloud, Data, Application Development & BI spaces.   We enable your growth At KPI, you can become who you want to be and learn skills that will take you further in your career Continuously upgrade yourselfDevelop as a future leaderDrive cloud enablement around the worldEngineering Excellence E", Remote , Posted 9 days ago
442, AWS Data Engineer ," KPI Partners, Inc. ","KPI Partners, A global consulting firm focused on strategy, technology, and digital transformation. We help companies tackle their most ambitious projects and build new capabilities. We provide solutions in Cloud, Data, Application Development & BI spaces.   We enable your growth At KPI, you can become who you want to be and learn skills that will take you further in your career Continuously upgrade yourselfDevelop as a future leaderDrive cloud enablement around the worldEngineering Excellence E"," Remote or Guadalajara, Jal., Mexico ", Posted 9 days ago
443, AWS Data Engineer ," KPI Partners, Inc. ","KPI Partners, A global consulting firm focused on strategy, technology, and digital transformation. We help companies tackle their most ambitious projects and build new capabilities. We provide solutions in Cloud, Data, Application Development & BI spaces. We enable your growth  At KPI, you can become who you want to be and learn skills that will take you further in your career Continuously upgrade yourself Develop as a future leader Drive cloud enablement around the world Engineering Excellence"," Remote or São Paulo, SP, Brazil ", Posted 9 days ago
444, AWS Data Engineer ," KPI Partners, Inc. ","KPI Partners, A global consulting firm focused on strategy, technology, and digital transformation. We help companies tackle their most ambitious projects and build new capabilities. We provide solutions in Cloud, Data, Application Development & BI spaces. We enable your growth  At KPI, you can become who you want to be and learn skills that will take you further in your career Continuously upgrade yourself Develop as a future leader Drive cloud enablement around the world Engineering Excellence", Remote , Posted 9 days ago
445, Sr. Data Engineer , Prudent Technologies and Consulting ,"Job Title: Sr. Data Engineer Role & Responsibilities: Design, build & maintain scalable data pipelines in Azure to ensure their compliance with up-time, security, and privacy.Actively contribute to both data & application governance initiatives by designing and implementing policies, procedures, and best practicesImplement API-based integrations to support continuing increases in data volume and complexity.Collaborate with report developers/analysts and business teams to improve data models that"," Irving, TX, USA ", Posted 8 days ago
446, Data Engineer ," Advent Global Solutions, Inc. ","Data Engineer. Location: Sunnyvale, CA On site. Only Fulltime   • The data engineer will be working with the Supply Chain Ops team including Data Migration from Teradata to Snowflake leveraging Spark, Iceberg, Dreamio and AWS S3.   Key responsibilities and expected “output”: •  Have expert knowledge in Spark to help process data before its moved to S3/Snowflake.    “Required” tech stack and other related details: Expert level experience with Spark, Python ,  PySpark and AWS"," Sunnyvale, CA, USA ", Posted 29 days ago
447, Data Engineer ," Numeric Technologies, Inc. ","Hi, Title: Data Engineer Location: California - Remote Duration: 6+ Months - W2 Contract only Client: Autodesk   Job Description:  Autodesk is seeking an experienced AWS Big Data Engineer to join our Marketing Automation Platform team. As a key member of the Data Engineering team, you will be responsible for designing, building, and maintaining scalable and efficient data pipelines on the AWS platform. Responsibilities: • Design, build, and maintain data pipelines on the AWS platform, utilizing ", Remote , Posted 8 hours ago
448, Geospatial Data Engineer - Architect , Darwin Recruitment ,"Are you a Geospatial data professional with a passion for innovation and a desire to shape the future of the internet? If so, we have an exciting opportunity for you to join a global brand and redefine this century's hottest utility! As the new Geospatial Data Architect, you will play a crucial role in designing and implementing cutting-edge spatial data solutions that will revolutionize the way consumers and businesses interact with the digital world. So if you're ready to unleash your creativi"," Colorado Springs, CO, USA ", Posted 13 days ago
449, Data Engineer , Compact Information Systems LLC ,"About Deep Sync Our parent company, Compact Information Systems LLC, is considered a pioneer of the data industry and was originally founded in 1988 as a mailing list company for direct marketers and print shops. Thirty-five years later, and combining the strength of our sister brands - AccuData Integrated Marketing, AlumniFinder, ASL Marketing, College Bound Selection Service (CBSS), Deep Sync Labs and HomeData - we have grown to become some of the foremost data suppliers in the U.S. Today, we "," Redmond, WA, USA ", Posted 8 hours ago
450, Azure Data Engineer , Crossfire Consulting Corp ,"Assignment Details Candidate would be working on the Enterprise Data and Analytics Platform. Responsible for the system architecture and solution design, ensuring the platform is scalable while performant. 1. Design and implement data pipelines using Databricks, Spark, and other Big Data technologies.  2. Collaborate with data scientists, analysts, and business stakeholders to understand their data needs and build solutions that meet those needs.  3. Build and maintain data warehouse and data la"," New York, NY, USA ", Posted 2 days ago
451, Data Engineer I , Travelers ,"Who Are We? Taking care of our customers, our communities and each other. That's the Travelers Promise. By honoring this commitment, we have maintained our reputation as one of the best property casualty insurers in the industry for over 160 years. Join us to discover a culture that is rooted in innovation and thrives on collaboration. Imagine loving what you do and where you do it.  Compensation Overview The annual base salary range provided for this position is a nationwide market range and re"," Hartford, CT, USA ", Posted 2 days ago
452," Data Engineer, Active Top Secret ", Maania Consultancy Services ,"Duties ·       Develop and design data pipelines to support an end-to-end solution. ·       Develop and maintain artifacts i.e., schemas, data dictionaries, and transforms related to ETL processes. ·       Integrate data pipelines with AWS cloud services to extract meaningful insights. ·       Manage production data within multiple datasets ensuring fault tolerance and redundancy. ·       Design and develop robust and functional dataflows to support raw data and expected data. ·       Provide Ti"," Washington, DC, USA ", Posted 8 days ago
453, Sr. Data Engineer ," Hexaware Technologies, Inc ","Position: Sr. Data Engineer Location: Boston, MA / Durham, NC / Westlake, TX Job Type: Full-time  Note: Hybrid mode position / Candidate must be available onsite 1 week per month.Skills and Expertise: 5-10 years of relevant hands-on working knowledge on the following: Snowflake is must.Python is must.SQL Queries (more into Scala and functional)Performance tuning/ Query optimizationControl M (BMC)LinuxDatawarehouse, Oracle DatabaseAWS Knowledge is preferable.Superb communication skillsKnowledge o"," Durham, NC, USA ", Posted 20 days ago
454, Data Engineer , Robert Half ,"Description Come join a growing and collaborative team in the insurance industry! Our Client is in search for for a Data Engineer that loves to be responsible for the movement and capture of data across the organization. If you are a skilled problem solver and have highly tuned decision-making abilities with experience or knowledge within Azure SQL Server, apply today - clal , or email your resume direct - my contact information can be found on LinkedIn under Shawn M Troy - Technology Practice D"," Cedar Rapids, IA, USA ", Posted 28 days ago
455, Google Cloud Platform with Senior Data engineer , HL Solutions LLC ,"Google Cloud Platform Data engineer  Location:  San Jose, CA or RTP, NC (Hybrid Role) Need locals from CA JD: Skills required to contribute:   Excellent communication and presentation skills.Extensive experience in Google Cloud stack – Google Cloud Storage, Google BigQuery, Google Data Flow, Google DataProc, Google Data Studio etc.Experience in job scheduling using Oozie or Airflow or any other ETL scheduler Design and build production data pipelines from ingestion to consumption within a big da"," Remote or San Jose, CA, USA ", Posted 9 days ago
456, DATA ENGINEER ," Galaxy i Technologies, Inc. ","|| DATA ENGINEER || W2 CONTRACT || WESTLAKE,TX,NJ,NC,NH,MA,UT ||  DATA ENGINEER  W2 CONTRACT  WESTLAKE,TX  HYBRID  JOB DESCRIPTION:  5+ years of relevant experience in data analytics or process improvement  Bachelor's degree (e.g., Computer Science, Engineering, Finance) / Master's degree preferred  Immediately apply Industry-leading analytics approaches and tools to transform data into insights  Experience deploying and working with diverse data environments  Financial Services experience prefe"," Merrimack, NH, USA ", Posted 2 days ago
457, Network Data Engineer , Raas Infotek LLC ,"Role: Network Engineer(Data Center) H1B and OPT are Welcome Job Description: Hands-on experience supporting and troubleshooting Routing Protocols (BGP, OSPF, EIGRP); Quality of Service and VLAN configurations; Layer 3 switching, including IP multicast; troubleshooting experience over wide area networks. In-depth understanding of various network services (Trunking, T1/DS1, MPLS, NAT, DHCP, DNS, NTP, HSRP/VRRP.) Experience with Cisco router and switch configuration (familiarity with the following ", Remote , Posted 7 hours ago
458, Data Engineer , Archon Resources ,"Duration: Direct Hire/Full-Time Location: On-Site in Fort-Worth, TX Pay: Yearly salary depending on experience and knowledge   SUMMARY: Looking for a Data Engineer for a Investment Firm client here in the Fort-Worth metroplex. The position is a Direct Hire opportunity, and a full-time Monday-Friday work schedule.     DUTIES AND RESPONSIBILITIES: Gathering requirements from financial professionals on data projectsArchitecture and maintenance of tables, stored procedures, triggers, UDFs, complex q"," Fort Worth, TX, USA ", Posted 2 days ago
459, Data Engineer , Xoriant Corporation ,"Role: Data Engineer Location: Remote  Duration: 12 Months (possible extension)   Job Details: Oracle DatabaseODI - Oracle Data IntegratorMS SQL Server, SSISdata warehouse or Data Lake, data modelling or profiling", Remote , Posted 31 days ago
460, Sr. Lead - Data Engineer , Capital One ,"Locations: VA - McLean, United States of America, McLean, Virginia  Sr. Lead - Data Engineer  Do you love building and pioneering in the technology space? Do you enjoy solving complex business problems in a fast-paced, collaborative, inclusive, and iterative delivery environment? At Capital One, you'll be part of a big group of makers, breakers, doers and disruptors, who solve real problems and meet real customer needs.  We are seeking Data Engineers who are passionate about marrying data with e"," McLean, VA, USA ", Posted 60+ days ago
461, Data Engineer , P2PSoftTek Inc ,"Position: Data Engineer Location: REMOTE   Description:Experience building cloud scalable, real time and high-performance data solutionsExpert level SQL skills, Java / Python/Pyspark and Data Bricks.Experience with scripting languages such as Shell, Python , SqlExperience with source control tools such as GitHub and related dev processExperience in orchestration tools like AirflowExperience with working in Azure / AWS /Google Cloud Platform environment"," Sacramento, CA, USA ", Posted 3 days ago
462, Azure Data Engineer Architect - (Synapse Analytics) , Strues Inc ,"Role: IT Architect (Azure Data Engineer architect – Synapse Analytics) (Contractor)  Client: Financial Location: DC Metro Area, Headquarters  Work Auth: GC-EAD, TN, H1B  *H1bs are allowed for this role with 15 years of experience 6 plus architecture and overall 15 years of relevant area experience is required. So strictly looking for senior resources Remote: No (Hybrid) Job Description: Provide technical architecture guidance and expertise in developing, architecting, and maintaining Azure Synap"," McLean, VA, USA ", Posted 2 days ago
463, Data Engineer , Net2Source Inc. ,"Net 2 Source Inc. is an award-winning total workforce solutions company recognized by Staffing Industry Analysts for our accelerated growth of 300% in the last 3 years with over 5500+ employees globally, with over 30+ locations in the US and global operations in 32 countries. We believe in providing staffing solutions to address the current talent gap  Right Talent  Right Time  Right Place Right Price and acting as a Career Coach to our consultants. Data Engineer 100% Remote 6 Months contract Ra"," Memphis, TN, USA ", Posted 2 days ago
464, Sr. Data Engineer ," Judge Group, Inc. ","Location:  Centennial, CO  Salary:  $68.00 USD Hourly - $78.00 USD Hourly  Description:  Our client is currently seeking a Sr. Data Engineer  Job Description: Looking for a Sr. Data Engineer with strong Tableau experience(over 5 years)  SQL for Reporting, Analysis and Data Visualization  Experience with Python and PySpark  Contact: This job and many more are available through The Judge Group. Find us on the web at"," Centennial, CO, USA ", Posted 19 days ago
465, Data Engineer , Factspan Inc ,"Job Description:   Role: Data Engineer Location: Atlanta, GA  (Complete Remote) Exp - 4- 10 years   Must Have: Hands-on experience in designing and implementing data pipelines in cloud platforms Hands-on experience in AWS and Spark Experience working in python to develop data pipelines Experience with Snowflake Excellent communication skills is required to be successful Good to Have:  Database design concepts including schema design, mapping documents Application design concepts including contex", Remote , Posted 3 days ago
466, Data Engineer , Georgia IT ,"Sr. Data Engineer  Location: 100% Remote Interview: 1 round to hire   Candidates need to have strong: SQLPython/PySparkDatabricksAirflowAWS – EMR, Glue, Kinesis, Lambda, S3Responsibilities Design and implement distributed data processing pipelines using Spark, Python, SQL and other tools and languages prevalent in the Big Data/Lakehouse ecosystem.Analyzes design and determines coding, programming, and integration activities required based on general objectives.Reviews and evaluates designs and p", Remote , Posted 2 days ago
467, Data Engineer , SPECTRAFORCE TECHNOLOGIES Inc. ,"Job Description Role: Data Engineer Location:  Durham, NC/Westlake, TX/ Boston, MA/Merrimack, NH (1 week onsite per month) Duration: 1 year long Pay rate starts from: $55/hr on W2 W2 only  Must Haves: Database developmentPythonWorking knowledge on AWSNice to have: Reporting tools – tableau or BI Candidate that has worked in a complex financial environment The Expertise and Skills You Bring Experience in building data lake in AWS using technologies like ec2, s3, Lambda, API Gateway, Load Balancer"," Durham, NC, USA ", Posted 2 days ago
468, AWS Data Engineer ," ScrumLink, Inc. ","Job Title : AWS Data Engineer  Location : Dallas ,TX Duration : 12+ Months   Job Description:- Prepare, handle, and supervise efficient data pipeline architectures. Build and deploy ETL/ELT data pipelines that can begin with data ingestion and complete various data-related tasks. Handle and source data from different sources according to business requirements. Work in teams to create algorithms for data storage, data collection, data accessibility, data quality checks, and, preferably, data anal"," Remote or Dallas, TX, USA ", Posted 10 days ago
469, Azure Data Engineer , Y & L Consulting Inc. ,"Hybrid Remote – Some Travel Required (Austin, TX – Project Kickoff & Major Milestone Meetings) Duration 6 months – option to extend or convert to FTE Keywords For Skills Match Azure Data Factory • Azure DevOps • Synapse • Databricks • 2+ year of coding experience with modern programming or scripting language (Python, Scala, Java, C# etc.). • Experience in developing/operating large-scale ETL/ELT processes with on-prem and cloud platforms; database technologies; data modeling. • Experience develo"," Austin, TX, USA ", Posted 17 days ago
470, Jr Data Engineer (Azure/AWS/Google Cloud Platform) , Samprasoft ,"SampraSoft is currently seeking for Jr Data Engineer position within our group, located in Alpharetta, GA. The candidate should be able to adapt to a challenging fast paced environment working with other Developers, Data Analysts and Cloud Engineers. Job Title: Jr Data Engineer Location: Alpharetta, GA. **NO 3rd Parties please. Requirements: Analytical and problem-solving skills.Strong desire to learn Azure/AWS/Google Cloud Platform cloud technologies, Python, and Spark to build resilient data p"," Alpharetta, GA, USA ", Posted 3 days ago
471, AWS Data Engineer ," InfoVision, Inc. ","Details:    Location: Dallas TX REMOTE  Duration: 12+ Months   Responsibilities  Assist Customer with defining modern data architecture and designs for Customer’s data analytics platform, providing an environment for consumption and utilization of dataAssist Customer with defining data architecture including raw data, conformed, structured, enriched, and aggregatedProvide Customer general best practices in building production quality data pipeline for ingestion, transformation and consumption to", Remote , Posted 14 days ago
472, Azure Data Engineer , Vaco Technology ,"Essential Functions  Design and develop data warehouses and data pipelines within Azure Design and develop Azure ML model execution pipelines Evangelize engineering design and development standards Act as a key contributor to the design and development lifecycle of analytic applications utilizing Microsoft Azure and BI technology platforms Participate in Agile ceremonies including daily stand-ups, sprint planning, retrospectives, and product demonstrations Produce efficient and elegant code that", Remote , Posted 21 days ago
473, Lead Data Engineer , Jobot ,"Sustainability and Carbon Impact SaaS, ML leader in the Agricultural Industry  This Jobot Job is hosted by: Duran Workman Are you a fit? Easy Apply now by clicking the ""Apply Now"" button and sending us your resume. Salary: $160,000 - $180,000 per year  A bit about us:  We are a machine learning software-based company. Our employees work remotely using our corporate offices to meet up for periodic in-house strategy and development meetings. Our application platform is built to apply our novel ML "," Houston, TX, USA ", Posted 6 days ago
474, Senior Data Engineer , IFF ,"Senior Data Engineer  It’s an exciting time to be part of the IFF IT family at our Union Beach, NJ location. We are a global leader in taste, scent, and nutrition, offering our customers a broader range of natural solutions and accelerating our growth strategy. At the heart of our success is investing in talent and valuing the diversity of our people. To drive breakthrough innovation and top performance, we aim to develop and engage employees through effective talent management, career developme"," Union Beach, NJ, USA ", Posted 16 days ago
475, ETL Developer - Data Engineer , Task Management Inc ,"Data Engineer ETL Developer - Contract- REMOTE Our Fortune 500 client has 2 contract roles for ETL Data Engineers.  Looking for a developer with at least three years of ETL/ELT development experience with hands-on Dataware Development experience with informatica and Azure Data factory and Informatica. Must have dimensional database experience, experience with SQL, experience with Informatica 9.0 or higher version and Azure data factory, cloud solution architecture and development experience stro", Remote , Posted 16 days ago
476, Senior Data Engineer - Fulltime , ASSYST ,"ASSYST is looking for Senior Data Scientist / Engineer, located in the NOVA / Washington, DC Metro Area to join our Data Science Innovation team. The current focus is on Information Assurance and Cybersecurity datasets for actionable insight. We work on many high-impact projects that serve various Federal Agencies, Non-Governmental Organizations, and Non-Profit and Commercial Organizations, to support their lines of business while fostering continuous innovation. Responsibilities: Responsible fo"," Sterling, VA, USA ", Posted 21 days ago
477, Azure Data Engineer , Robert Half ,"Description Robert Half has an opening for a Sr. Data Engineer who understands supply chain management to work onsite in Jacksonville, FL.  · Designing and implementing highly performant data ingestion pipelines from multiple sources using Azure tools  · Developing scalable and re-usable frameworks for ingesting of assorted data sets  · Integrating the end-to-end data pipeline to take data from source systems to target data repositories ensuring the quality and consistency of data is always main"," Jacksonville, FL, USA ", Posted 25 days ago
478, data engineer , INSPYR Solutions ,"Title: Senior Data Engineer  Location: Fort Washington, PA (Philadelphia, PA) (Hybrid)  Duration: Direct hire Compensation: Base $125K  Work Requirements: Authorization to work in the United States as a W-2 Employee REQUIREMENTS Working with IT and business resources, support the Data Warehouse strategy and Business Intelligence initiatives: Lead development activities to migrate the current on-premises SQL Server DW to Snowflake on AWS. Gather requirements for Data Warehouse improvements and tr"," Philadelphia, PA, USA ", Posted 19 days ago
479, Sr. Data Engineer , Jefferson Frank ,"130k - 140k + 8% Bonus Our TOP CLIENT has retained us for a Data engineer role. The Data Engineer will be creating data solutions, designs and manufacturing for residential Spa and commercial pools. Our client is looking for a Data Engineer with a fresh perspectives in leveraging modern technology to deliver cloud-base technology for data integration and data warehousing. Must Haves: Hybrid work model 2x onsite per week.  Snowflake and Kafka SQL Database Scala or Python (Programming)  TOP REQUIR"," Clemmons, NC, USA ", Posted 20 days ago
480, Sr. Data Engineer , Jefferson Frank ,"130k - 140k + 8% Bonus Our TOP CLIENT has retained us for a Data engineer role. The Data Engineer will be creating data solutions, designs and manufacturing for residential Spa and commercial pools. Our client is looking for a Data Engineer with a fresh perspectives in leveraging modern technology to deliver cloud-base technology for data integration and data warehousing. Must Haves: Hybrid work model 2x onsite per week.  Snowflake and Kafka SQL Database Scala or Python (Programming)  TOP REQUIR"," Charlotte, NC, USA ", Posted 20 days ago
